game_name,app_id,price_usd,age_rating,game_mode,genres,user_id,review_text,voted_up,votes_helpful,votes_funny,created
Dont Starve,219740,9.99,0,solo,"Adventure, Indie, Simulation",76561198058069984,"I like coming back to this game occasionally, but every time I just get bored as there's no real point to it. The idea is good, but there's no reason to play it beyond the first few season cycles. There is an ""end"" but it feels slapped on, rather than like its part of the game.

Is a novel idea, but would not recommend playing unless you get it for free.",False,1,0,1762149412
Dont Starve,219740,9.99,0,solo,"Adventure, Indie, Simulation",76561199490263998,not for me at all,False,0,2,1761797387
Dont Starve,219740,9.99,0,solo,"Adventure, Indie, Simulation",76561198014988246,"Any game that requires you to die again and again, is not a well made game, and is designed to frustrate people. The developers hate their players, no other way to say it. What a waste of money. Do not buy this game. Go play something fun, and not so frustrating. Game could have benefited from a tutorial, but you are left completely in the dark as to what to do, or how things function. Stupid.",False,2,5,1761592570
Dont Starve,219740,9.99,0,solo,"Adventure, Indie, Simulation",76561198086384897,"I've played The Forest in the past and the survival game idea is great in itself. However, I dind't like that the player isn't able to go back to a previous save from the game interface (but rather only manually backing up and restoring the save files as a workaround). I have also encountered a bug that made my longest game run unusable.",False,1,0,1761143274
Dont Starve,219740,9.99,0,solo,"Adventure, Indie, Simulation",76561198102271072,"Used to love this game, now unendingly disappointed Klei won't provide any updates in favor of Don't Starve Together, which crashes anytime I try to load a world with caves.",False,3,0,1761023556
Dont Starve,219740,9.99,0,solo,"Adventure, Indie, Simulation",76561198936218447,Discontinued and not worth it game the dlc dont make you wanna play more just save your money to buy: Dont Starve Together,False,0,0,1760646979
Dont Starve,219740,9.99,0,solo,"Adventure, Indie, Simulation",76561199841163407,*Mac* Doesn't work at all. Won't start up. Support refused to help and Steam wouldn't refund.,False,0,0,1760472000
Dont Starve,219740,9.99,0,solo,"Adventure, Indie, Simulation",76561198046428805,No matter how many times I come back to this game I just kinda don't get it. I like the style but I feel no sense of a goal,False,5,0,1759877608
Dont Starve,219740,9.99,0,solo,"Adventure, Indie, Simulation",76561198390827332,"It's Don't Starve, the game in itself is pretty fun, but in the interest of being honest, this version is absolute trash. They updated and updated and updated Dont Starve TOGETHER, SO MANY TIMES, and left this version behind in the dust, to the point where if you've played and gotten used to Dont Starve Together, this version just feels like a slow, trashy, alpha version. Not worth buying, at all, considering you can just buy DST and play offline, alone, and have all the new, nice stuff.",False,8,0,1759684722
Dont Starve,219740,9.99,0,solo,"Adventure, Indie, Simulation",76561199379709224,"DST is a really good game, but Joew is a really bad guy.
Wanton modification of the sold Wigfrid helmet skin, the reason given is that the hexagram is taboo by the Jews.
How ridiculous! If the hexagram is a taboo, does Islam still say that Pigman cannot be designed to be edible? Will Maxwell still be sued for racial discrimination? Will Wigfrid still be reported by vegetarians to be taken off the shelves?
DST is DST and once you start being politically correct there is no going back. Chinese players have had enough of political correctness, and now they continue to endure Jewish political correctness in the game, which is unbearable! Not only that, but also directly modify the sold skins because of this political correctness! What do you think of the player's property as! ?
Advice to players: DST can be played, but it is not recommended to buy skins, because you don't know if Joew will move out the so-called political correctness to infringe on the player's property one day.",False,2,0,1759462151
Dont Starve,219740,9.99,0,solo,"Adventure, Indie, Simulation",76561198268761580,Combat is super clumsy,False,0,0,1759236606
Dont Starve,219740,9.99,0,solo,"Adventure, Indie, Simulation",76561198849824215,"games ass idk why everyone plays it

9/27/25 UPDATE: NVM I WAS REALLY HIGH BUT TRIED PLAYING IT NOW AND ITS REALLY FUN",False,0,3,1758950048
Dont Starve,219740,9.99,0,solo,"Adventure, Indie, Simulation",76561198313826379,"The game no longer works on mac. When I could play it, I enjoyed it",False,1,0,1758780470
Dont Starve,219740,9.99,0,solo,"Adventure, Indie, Simulation",76561198064739044,If you have to explain the interface its a bad interface.,False,1,0,1758554439
Dont Starve,219740,9.99,0,solo,"Adventure, Indie, Simulation",76561197961159689,Buggy game from a developer who focuses on producing more garbage DLC over keeping their games working well.,False,1,0,1758538022
Dont Starve,219740,9.99,0,solo,"Adventure, Indie, Simulation",76561199345691042,"I got this on sale, understood nothing and died back to back, then my friend gifted me together version, and I can't refund it too since it's been 2 weeks!

Of course the reason why I didn't like it is not the thing above but rather me not liking the gameplay loop. Your hand is not hold for anything, you must learn everything on your own and when the game is as complex as Terraria (but without a Guide to help you), you just have to look up everything in order to actually progress which is unfun!",False,3,7,1758465776
Dont Starve,219740,9.99,0,solo,"Adventure, Indie, Simulation",76561198286644425,"Meh.

Pretty graphics, but the game loop boils down to running around collecting stuff in order to craft things - not terribly original nor engaging.

That said, I think the exact same thing about No Man's Sky, so I suspect I'm in a pessimistic minority here.",False,9,0,1758370943
Dont Starve,219740,9.99,0,solo,"Adventure, Indie, Simulation",76561199426974592,"This game is fantastic, and the fact you can get it on-sale for 2$ is mind blowing to me. 
Despite this, purchasing the sequel 'Don't Starve Together' will give you a much better experience.
This isn't to deter one's greatness from the other (as they're both great) however the sequel has some aspects that just prove it's superiority, making it a more interesting, vast, and entertaining version than the first one.",False,2,0,1758343626
Hollow Knight,367520,14.99,0,solo,"Action, Adventure, Indie",76561199482010693,the red one is hot,True,0,0,1764184072
Hollow Knight,367520,14.99,0,solo,"Action, Adventure, Indie",76561198176254298,"Nice Game
",True,0,0,1764182853
Hollow Knight,367520,14.99,0,solo,"Action, Adventure, Indie",76561199876072194,"Hollow knight is the BEST indie game I've ever played. Its a big world with all sorts of different side quests for you to do (and don't even get me started on the music). Once you play it there is no going back, this game is so phenomenal and will probably want to make you buy then sequel to this game. You will get achievements just to impress others or to have them just for how some of them look. Some times you will get greedy other times you'll want to stick to what you know.

And for that reason, I recommend hollow knight.",True,0,0,1764182329
Hollow Knight,367520,14.99,0,solo,"Action, Adventure, Indie",76561198807876758,"Completely getting railed by bugs 10/10 would do again.
Unexpectedly best Game I've ever played, insane soundtracks, Visuals, and gameplay. This game ignited my passion for Souls like games so thank you Team Cherry that you gave me a reason to hate my life even more.

Müsst ihr wissen.",True,0,0,1764182155
Hollow Knight,367520,14.99,0,solo,"Action, Adventure, Indie",76561199548887803,my favorite game,True,0,0,1764181927
Hollow Knight,367520,14.99,0,solo,"Action, Adventure, Indie",76561199071985599,Haven`t finished the game yet but i am having A LOT of fun!,True,0,0,1764181831
Hollow Knight,367520,14.99,0,solo,"Action, Adventure, Indie",76561199654282255,an amazing game with brilliant graphics and beautiful music the bosses can be a bit tricky but eventually you will beat them and after you get a nice bit of peace and amazing views.,True,0,0,1764181414
Hollow Knight,367520,14.99,0,solo,"Action, Adventure, Indie",76561199766986496,straight hollowing my knight rn,True,0,0,1764179682
Hollow Knight,367520,14.99,0,solo,"Action, Adventure, Indie",76561199232911538,"Absolutely insane game. I loved it, the gameplay is addictive and just challenging enough. The world is beautiful, full of live and small mysteries.",True,0,0,1764174979
Hollow Knight,367520,14.99,0,solo,"Action, Adventure, Indie",76561199832364538,"Stop looking here, GET THE FRICKING GAME ;3",False,1,2,1764176246
Hollow Knight,367520,14.99,0,solo,"Action, Adventure, Indie",76561199216828196,This game is to fun and costs to little,False,0,1,1764117488
Hollow Knight,367520,14.99,0,solo,"Action, Adventure, Indie",76561198199991637,Redditknight,False,0,0,1764036472
Hollow Knight,367520,14.99,0,solo,"Action, Adventure, Indie",76561198862084319,not as funny as balan wonderworld,False,0,0,1764028874
Hollow Knight,367520,14.99,0,solo,"Action, Adventure, Indie",76561199871920604,i hate game >:(,False,0,2,1763992120
Hollow Knight,367520,14.99,0,solo,"Action, Adventure, Indie",76561198814166435,"game is genuinely awful and unplayable without mods, horrible mechanics",False,0,0,1763972145
Hollow Knight,367520,14.99,0,solo,"Action, Adventure, Indie",76561199569093748,"There are many ways to get lost in this game, and it’s easy to end up stuck in areas you’re not supposed to reach yet. For example, I found myself in the final location of the game right after defeating the second boss. Because of issues like this, I can’t confidently recommend the game at this time. However, who knows—maybe I’ll return to it someday and gain a better appreciation for what it has to offer.",False,0,0,1763945359
Hollow Knight,367520,14.99,0,solo,"Action, Adventure, Indie",76561198357223351,Great game. I hate it.,False,0,1,1763939040
Hollow Knight,367520,14.99,0,solo,"Action, Adventure, Indie",76561197967071365,"Very fun. Somewhat challenging. Had a lot more to it than it seemed at first.
Credits are unskippable. Won't recommend.",False,0,0,1763936332
Hollow Knight,367520,14.99,0,solo,"Action, Adventure, Indie",76561198079307903,"The game was so overhyped Im kinda disapointed tbh, its smooth and sharp but unforgiving, endless roaming and backtracking trying to find the right path. 6/10",False,0,0,1763927159
Hollow Knight,367520,14.99,0,solo,"Action, Adventure, Indie",76561199100406088,"ITS TO HARD 
",False,0,0,1763924030
Hollow Knight,367520,14.99,0,solo,"Action, Adventure, Indie",76561198127494838,"meh
It's not bad, i just don't enjoy it",False,0,0,1763921919
Hollow Knight,367520,14.99,0,solo,"Action, Adventure, Indie",76561198046683367,"Massively overrated imo. If you want to spend hours wondering around aimlessly and then punished for it, go ahead. 

I do not understand the hype personally and think this is a rather niche game.",False,0,0,1763918977
Hollow Knight,367520,14.99,0,solo,"Action, Adventure, Indie",76561199136218296,jebać horneta jebaną dziwke do jebana od dupy strony,False,0,0,1763906779
Hollow Knight,367520,14.99,0,solo,"Action, Adventure, Indie",76561198288259906,"The world, art and music is just pure perfection. Combat is also great, but the checkpoint system and backtracking is not fun at all. This game needed a better checkpoint system, especially near Boss fights, it is just frustrating for the wrong reasons and not fun anymore. Also, the map system sucks, where you need a Charm slot to see where you are in the map. 

I keep on coming back to play forward because of the world, the art, and the music, and then again hit the same wall. I give up.",False,0,0,1763887851
Hollow Knight,367520,14.99,0,solo,"Action, Adventure, Indie",76561199052289144,overrated as hell,False,1,0,1763875764
Hollow Knight,367520,14.99,0,solo,"Action, Adventure, Indie",76561198089892322,Skill issue.,False,0,0,1763873732
Hollow Knight,367520,14.99,0,solo,"Action, Adventure, Indie",76561198064119079,Frustrating platformer.,False,0,0,1763842668
Hollow Knight,367520,14.99,0,solo,"Action, Adventure, Indie",76561199813843196,there was no chicken,False,1,0,1763832907
Omori,1150690,19.99,0,solo,"Adventure, Indie, RPG",76561199055398013,good game i guess,True,0,0,1764183027
Omori,1150690,19.99,0,solo,"Adventure, Indie, RPG",76561198842634826,Artistic masterpiece.,True,0,0,1764171680
Omori,1150690,19.99,0,solo,"Adventure, Indie, RPG",76561198028643634,"Made me cry. One could believe that the lead writer of this game was offloading some intense personal trauma because it feels genuine. The combat is really fun and unique. You can spend well over 100 hours finding all there is to do in this game. One of the few RPG's I've taken the time to 100%.

I’ve played the Switch port some but never finished it. It has some additional content like bosses and playable characters but I’m pretty sure that stuff has since been added to Steam as well. Correct me if I’m wrong. Runs fine.",True,0,0,1764165228
Omori,1150690,19.99,0,solo,"Adventure, Indie, RPG",76561199849910465,"Omori is, one of the greast pieces of art ive ever had the pleasure of experiencing. I could say so much. SO much about the artstyle, combat system, the characters, the comedy, the drama, etc. but theres no need. It is impossible to show why this game is such a masterpiece. Only flaw i can think of, is that it plays wierd, but thats a flaw on rpgmakers end. I love this game so much, and im so happy i get to experience it. This game has made my life better in every way.
Omori is not a sad game. It is an uplifting story with an uplifting message. This game actually made me a better person. 
Omori, is a masterpiece.",True,1,0,1764127162
Omori,1150690,19.99,0,solo,"Adventure, Indie, RPG",76561199865708030,BUY IT RN RAAAAAHHHH,True,1,0,1764125529
Omori,1150690,19.99,0,solo,"Adventure, Indie, RPG",76561199215688033,masterpiece,True,0,0,1764122485
Omori,1150690,19.99,0,solo,"Adventure, Indie, RPG",76561199190540389,i love the part where i get to gamble$$$$$$$$$$$$$$$$$$$$$$,True,0,0,1764121306
Omori,1150690,19.99,0,solo,"Adventure, Indie, RPG",76561199230315634,INCREDIBLE GAME. JUST AMAZING. WORTH UR MONEY BUY BUY BUY BUY OMGGGGGGGGGG,True,0,0,1764119155
Omori,1150690,19.99,0,solo,"Adventure, Indie, RPG",76561199148441845,This game is so entertaining and made me fucking cry,True,0,0,1764108848
Omori,1150690,19.99,0,solo,"Adventure, Indie, RPG",76561199003828035,kel is a bad bad person who is mean to aubrey and stole 20 fucking dollars when he CLEARLY had his fucking wallet because he bought A BIG BAG OF CANDY (HIS WORDS) and EVERY FUCKING PIECE IS A WHOLE ASS DOLLAR THERE IS NO WAY HE COULD NOT AFFORD THE 20 DOLLARS  FOR THE COOKBOOK THAT HE PICKED OUT the game is aight tho,False,0,2,1764135847
Omori,1150690,19.99,0,solo,"Adventure, Indie, RPG",76561199004776778,im not gay enough to beat the game sorry guys 0/10,False,0,1,1763965648
Omori,1150690,19.99,0,solo,"Adventure, Indie, RPG",76561199848593180,"I think it may have a good story, but to me the prologue was way too long and boring. From what I've heard, it is a great game but it's just so boring to me that I didn't even went past the prologue because it was too boring. I'm a very patient person, so I was really dissapointed by the length of the start.",False,0,0,1763918513
Omori,1150690,19.99,0,solo,"Adventure, Indie, RPG",76561199525540460,great story with a really-intense-boring gameplay,False,0,0,1763573476
Omori,1150690,19.99,0,solo,"Adventure, Indie, RPG",76561199387665271,"Feels like the game is trying too hard to endear itself to you, it has the same quirky humor and style Undertale has except Undertale does it better and is actually charming, there's just so much bullshit in this game I found annoying, it doesn't hit for me. The combat system sucks. The game is very slow. I had a hard time sitting through the very start of the game because it's so drawn out even though nothing really happens. The character interactions go on for so long, for no reason. I don't know if the rest of the game is like this so I don't want to say the story of the game is bad, I had high expectations for this game from what I heard about it but I really think this is one of those games that's better if you read a wiki on or watch as a playthrough, playing the game itself feels like a chore",False,3,1,1762737356
Omori,1150690,19.99,0,solo,"Adventure, Indie, RPG",76561198283544361,"I just couldn't get in to it. The RPG maker aesthetic outside of combat is ugly and the sprites are super small. Combat always feels like an uphill battle because it feels like no matter what strategy I try using, I'm doing something wrong and getting hit HARD by the enemies. This became tedious and annoying when exploring and going back the screen I was just on like 5 seconds ago just to find out that the enemies reapawned, and they're a pain to avoid! I've played so many JRPG type games but the combat system just wasn't clicking for me. 

I also just couldn't get into the humor or be bothered to care about the side characters. I dunno, maybe it's because I played Deltarune so much only a couple of months before this game and I intentionally and unfairly compare the 2 of them - of course this would seem dull in comparison to that game for me. 

It's a shame because I really wanted to like this game. The combat in concept is a really fun idea and the story seems interesting. Overall it was just too meh for me to want to continue. 

I would probably still recommend this game, but there's one really annoying flaw that I experienced while playing it that I can't forgive. The issue is simple yet big enough to have a negative impact on gameplay for multiple sections of the game - THIS GAME IS LITERALLY SO DANG DARK. I encountered a section where you're alone in a dark house, and I almost thought my system was frozen because I could barely see anything. This resulted in me fumbling around in the dark and extending that section of the game by like another half hour longer than it was supposed to take because I just couldn't see where to go. I tried everything I could think of involving messing with brightness, contrast, gamma, docking it to my TV, etc. It seems this is not an issue unique to me, because I found a couple of forums concerning the issue and none of their propsosed solutions worked. I guess this was the case for a couple of other people on the forums because they quit the game too since there are multiple dark sections of the game they didn't want to deal with lol. I just don't see how the devs haven't fixed something so glaringly obvious and annoying after all this time that the game has been released. I would've considered returning this and purchasing it on the Nintendo Switch but I already went over the 2 hour play time and couldn't return it so I didn't want to waste my money again 🙃

I swear this game used to be listed as Steam Deck verified on here when I initially made the purchase, maybe it was changed to ""playable"" because of this issue? Either way, if you're planning to play on the Steam Deck, then do not buy Omori.",False,2,0,1762403184
Omori,1150690,19.99,0,solo,"Adventure, Indie, RPG",76561199507395455,I’m sure the stories great but the 3 hours of gameplay I had were I think the most miserable three of my life,False,5,1,1762301521
Omori,1150690,19.99,0,solo,"Adventure, Indie, RPG",76561198122482736,It says that I played 11 hours on this game but unfortunately I could only get it to load once for 3 or so minutes. The window was tiny and I tried relaunching to play it again and could never get it to work again. I'd like to play the game but it isn't working on my mac. If someone smarter than me knows how to make it work please reply,False,1,0,1762036673
Omori,1150690,19.99,0,solo,"Adventure, Indie, RPG",76561198108344535,"Bought because of all the very positive reviews.  Meh game, not sure why people like it.  The gameplay isn't great, the story isn't great, the graphics aren't great.  ¯\_(ツ)_/¯",False,0,0,1760657816
Omori,1150690,19.99,0,solo,"Adventure, Indie, RPG",76561199159252928,"Personally found it really boring, i really really wanted to enjoy the game :(

[i] Italian text [/i]",False,2,2,1760201177
Omori,1150690,19.99,0,solo,"Adventure, Indie, RPG",76561199090438594,"At first I recommended it. Now I don't. Gameplay-wise, there exists both the dream world and the real world. That's not what the game actually calls them, but it's what I'll call them. Each world has ""sequences"" to them. You cannot explore the entirety of the dream world before the real world, and vice versa. The first sequence of the dream world seemed decently engaging enough, where the rules that the game establishes for itself not being set in stone, and each interaction and fight feeling new and fresh. This maintains itself in the first sequence in the real world, where I was able to explore it and find all the connections between it and the dream world. And then after that...the rules have already been established, and the game doesn't particularly deviate from it, if at all. And those interesting parallels aren't really drawn anymore. So it's just a long, repetitive...well, I wouldn't say slog. But it isn't particularly enjoyable.
 Story wise...there is a twist that completely sours the story. A part of me doesn't want to reveal the twist, but then again, if you don't want to play a game again simply because you know the twist to it, what's the point of the game, really? In short, I can't sympathize with manslaughter. You, the character, have committed a criminal act. If not involuntary manslaughter, then staging it to look like a suicide certain doesn't help things, either. And THEN the main character and the character who helped you stage the body feel bad about it? They feel bad about losing a friend? Would it have killed them to, I don't know, call for help? Instead of staging it to look like a suicide? That's what a friend would do! Get their friend help! Now, I haven't actually reached the end. I've just seen enough spoilers through the community of this game to have found that out. And that twist just completely breaks my suspension of disbelief. Getting so attached to some characters in a movie, show, or video game just for it to not resolve in a fulfilling way...you know, closure...that's one of the greatest sins a piece of media can commit. I think that part is what's most egregious about this game.",False,2,0,1760145881
Omori,1150690,19.99,0,solo,"Adventure, Indie, RPG",76561198401064971,"Pros:
-good music
-good art
-great story
-charming dialogue, clearly the game has love put into it...

Cons:
-RPG game (Side quests are tedious, battle system is tedious... but this is just a personal opinion)
-90% sure the creator OMOCAT is a pedo.... Review would have been positive but I don't want to support them so here we are. (Don't take this as s serious allegation, instead research the MULTIPLE dramas surrounding the creator yourself...)
-This may fall under me disliking RPGs, but I really wish there was no/a higher limit on the number of saves you can have at once.
-Interacting with stuff is weird. Sometimes you need to press and hold, and sometimes it wont let you close out after a single tap. I would look at the bathroom mirror for 0.1 second (because you need to press and hold) and then be forced to look at that one photo in the bookshelf (not exactly a fan of that or that one unskippable boss's design btw [boohoo], but this last bit is an opinion also)

Overall, good game, would recommend, but maybe hesitate before supporting the creator",False,3,2,1759822359
Omori,1150690,19.99,0,solo,"Adventure, Indie, RPG",76561197998320378,I cant recommend any game longer than a couple of hours that does not have cloud saves.,False,1,0,1759521091
Omori,1150690,19.99,0,solo,"Adventure, Indie, RPG",76561198299265434,"What if Yume nikki was made by a fujoshi and it was mid

Or in other words, quirky rpg about depression

",False,11,2,1758962634
Omori,1150690,19.99,0,solo,"Adventure, Indie, RPG",76561198892861874,MID fucking ori MIDori omorMID omoMID oMID,False,6,1,1758945184
Omori,1150690,19.99,0,solo,"Adventure, Indie, RPG",76561199415717110,im depressed bc of this game,False,4,0,1758916077
Omori,1150690,19.99,0,solo,"Adventure, Indie, RPG",76561198977837783,"I would've reccomended this game if it didn't delete all of my progress for some reason.
It's a really nice and interesting game, that's for sure. But I just don't want to play it anymore because it deleted my data, which is unfortunate. Unless someone knows how to get my lost data back. Then I'm willing to play it again (I saw I wasn't the only one with this exact same problem)",False,4,0,1758749153
Omori,1150690,19.99,0,solo,"Adventure, Indie, RPG",76561199351989544,"not worth buying if you own a mac, literally doesn't run at all, even with patches. 3/4 of my time spent on the game has just been an attempt to get it running.",False,1,0,1758673119
