game_name,app_id,price_usd,age_rating,game_mode,genres,user_id,review_text,voted_up,votes_helpful,votes_funny,created
Crusader Kings III,1158310,49.99,0,solo/multiplayer,"RPG, Simulation, Strategy",76561199834676115,"Damn game wasted nearly 3 hours of my time. First time it took over 40 mins to launch, I tried to be patient and told myself that maybe it was just for the first launch, how wrong I was. So I tried to load a new game and it crashed after 3 minutes of waiting for it to load. No problem, I'll just turn down the settings to the lowest quality on everything and maybe it'll work? Nope, a few more crashes later and the games failing to send my crash reports, I think like 1 actually sent. Anyways, don't waste your time or money, the game WILL crash. I'm genuinely surprised this game has good reviews. For context, I have a game from 2009 that's double the storage and doesn't have its own launcher to help yet it runs smoothly and WORKS, wish I played that instead of wasting my time on this scam.",False,0,0,1763985707
Crusader Kings III,1158310,49.99,0,solo/multiplayer,"RPG, Simulation, Strategy",76561198013878040,"Do you want to spend hours managing a plethora conflicts and interests just for the game to crash to desktop without warning? Oh, it was near the end of the month / year? No recent autosave, so time to do all that again 5 more times while avoiding whatever landmines are causing the crash. 

Finally got your campaign on track? Don't worry, the new update will make your saves incompatible. Now you get to do it all over again. 

If you liked the idea of playing the game, you're in luck - all there is is [i]the idea of playing it[/i]. No pesky reality of a playable game.",False,0,0,1763981514
Crusader Kings III,1158310,49.99,0,solo/multiplayer,"RPG, Simulation, Strategy",76561198165437652,"Multiplayer is unplayable. As the game reaches the late stages, the desync issues get worse and worse. I’ve checked the forums and it’s the same problem people have been reporting since 2023. It really seems like they don’t care enough to even consider fixing it, so my review is negative.",False,1,0,1763949264
Crusader Kings III,1158310,49.99,0,solo/multiplayer,"RPG, Simulation, Strategy",76561198040444231,"The new expansion has made the game unplayably slow on macos - or, anyone not using the DX11 renderer, according to the forums.

I realize we're a minority of the userbase, but we also paid to be able to play the game. Paradox's apparent indifference to testing on all platforms they allegedly support - and for which they're still happy to charge just as much money - is really disappointing.",False,3,0,1763946463
Crusader Kings III,1158310,49.99,0,solo/multiplayer,"RPG, Simulation, Strategy",76561198039505608,constant crashes,False,0,0,1763942797
Crusader Kings III,1158310,49.99,0,solo/multiplayer,"RPG, Simulation, Strategy",76561198054307656,"Do not purchase unless you purchase all the DLCs. The base game has been made unplayable due to the legitimacy update. Cannot even play old versions just crashes every time, was a great game at one point.",False,0,0,1763938536
Crusader Kings III,1158310,49.99,0,solo/multiplayer,"RPG, Simulation, Strategy",76561198160198731,review is out of sync,False,0,0,1763914684
Crusader Kings III,1158310,49.99,0,solo/multiplayer,"RPG, Simulation, Strategy",76561198013148490,"Looks promising, but unfortunately is just a really expensive screen saver, with it unable to get past the initializing scene. Nothing to do with my tech specs, so I guess just some kind of bug? Shame.",False,0,0,1763899911
Crusader Kings III,1158310,49.99,0,solo/multiplayer,"RPG, Simulation, Strategy",76561198102743071,"Yeah, the first year or so was fun. The first set of DLC was fun. Now, having put 730 hours into it, it is a mess. Every new update totally fucks up things more and more. My last drop was how the addition of the new eastern areas totally broke my long game in Europe. Do not pay them money.",False,1,0,1763849248
Crusader Kings III,1158310,49.99,0,solo/multiplayer,"RPG, Simulation, Strategy",76561198061060021,"Crashes constantly, wars feel like sh*t, movement is abysmal. Everything else is solid.",False,1,0,1763843620
Divinity Original Sin,230230,0.0,0,solo/multiplayer/co-op,"Adventure, Indie, RPG, Strategy",76561198139793592,CRPG renaissance,True,0,0,1763815289
Divinity Original Sin,230230,0.0,0,solo/multiplayer/co-op,"Adventure, Indie, RPG, Strategy",76561199025497003,"Divinity: Original Sin – Enhanced Edition is a tactical role-playing game that revitalizes the classic CRPG formula with depth, freedom, and smart writing. It combines strategic turn-based combat, meaningful player choice, and cooperative gameplay to create one of the most complete role-playing experiences of its generation.

The story follows two Source Hunters investigating a mysterious murder in the city of Cyseal, gradually uncovering a plot that threatens the fabric of reality. The narrative is layered with humor, moral ambiguity, and philosophical undertones. Dialogue choices matter, influencing character relationships, quests, and even combat outcomes.

Gameplay is defined by its interactivity. Almost every object, surface, and environmental element can be manipulated. Fire spreads, water conducts electricity, and poison ignites. Combat becomes a puzzle where creative thinking often wins over brute force. This system rewards experimentation, not repetition.

Character creation and progression are flexible. Players can customize skills, attributes, and abilities without being locked into rigid classes. Cooperative play enhances this freedom—two players can explore, argue over choices, or separate to pursue different objectives simultaneously. The resulting dynamics make co-op feel organic rather than forced.

Visually, the Enhanced Edition improves textures, lighting, and interface clarity while keeping the game’s distinct hand-painted fantasy style. The redesigned UI and full voice acting make exploration and dialogue more immersive. Every conversation and environment feels alive and reactive.

The writing maintains a balance between wit and seriousness. Quests often carry multiple solutions, and morality is never simple. Whether you’re solving a murder, arguing with a talking shell, or deciding the fate of an entire village, the game constantly invites critical thinking and reflection.

In essence, Divinity: Original Sin – Enhanced Edition is a masterclass in player agency and tactical depth. It’s challenging, rewarding, and endlessly replayable. Every decision feels personal, every victory earned through intellect and creativity. It stands as one of the finest examples of modern role-playing design rooted in classic principles.",True,1,0,1762683612
Divinity Original Sin,230230,0.0,0,solo/multiplayer/co-op,"Adventure, Indie, RPG, Strategy",76561197966566545,Couldn't get anyone to play this game with me because turn based RPGs weren't the wave to ride back then. Finally got a friend IRL that would come over and split screen and we almost beat it before they moved away. Solid turn based RPG experience and good memories.,True,1,0,1761495399
Divinity Original Sin,230230,0.0,0,solo/multiplayer/co-op,"Adventure, Indie, RPG, Strategy",76561198865362830,"This is better than enhanced edition.  Wands are overpowered in enhanced edition and destroy the balance of the game.  As a hardcore player, the enhanced edition also added some unfair things that a person seeing it for the first time could not be prepared for - deaths that arent your fault dont rly exist in classic.  also in the enhanced edition theres so many shops you can just gear up by shopping too easily.  i wouldnt play enhanced edition again, and would recommend this game to everyone its absolutely amazing to play blind with a friend.  masterpiece.",True,1,0,1760820759
Divinity Original Sin,230230,0.0,0,solo/multiplayer/co-op,"Adventure, Indie, RPG, Strategy",76561198046669416,Great game for anyone who's played BG3,True,0,0,1759973457
Divinity Original Sin,230230,0.0,0,solo/multiplayer/co-op,"Adventure, Indie, RPG, Strategy",76561197969657227,"iconic rpg, over all great game",True,0,0,1759459818
Divinity Original Sin,230230,0.0,0,solo/multiplayer/co-op,"Adventure, Indie, RPG, Strategy",76561198027895391,"Nice game, sadly use Nintendo patent",True,0,0,1758666794
Divinity Original Sin,230230,0.0,0,solo/multiplayer/co-op,"Adventure, Indie, RPG, Strategy",76561199135751866,I am enjoying playing this game but I just die all the time.,True,0,0,1757827487
Divinity Original Sin,230230,0.0,0,solo/multiplayer/co-op,"Adventure, Indie, RPG, Strategy",76561197993257199,"Classic good, but play Enhanced One, you gonna love it",True,0,0,1757196467
Divinity Original Sin,230230,0.0,0,solo/multiplayer/co-op,"Adventure, Indie, RPG, Strategy",76561198046581669,You have to invest a lot of time reading and be careful with the buttons... It is not to just go and have casual fun,False,0,0,1763499882
Divinity Original Sin,230230,0.0,0,solo/multiplayer/co-op,"Adventure, Indie, RPG, Strategy",76561198160031418,"This game to me is one that deserves a mixed rating. While I liked the game and had fun playing it, there were plenty of times  when it felt more of a slog to get through. The world is semi open-world that is both good and bad. Constant Saving felt like a must

Starting off, making my characters was fun, there were a good amount of classes to choose from. Playing around with some starting skill options, personal customization was ok nothing too crazy for the Two Player Characters you create as my heroes.
A few voices to choose from, personalities etc. Not everything in the game is voiced, most MC dialogue gets voiced with their little side quips, side characters here and there, most dialogue will be read. A few companions to choose from, I choose two and rocked with them, since I believe if you swap them in later their level's won't match yours, needs more testing?

Combat was fun and not fun, while it worked and gave me chances to be creative with combining the environment, items I have, spells and such to fight, it meant the enemy could do the same. With the world being open-ish often I'd find myself in fights I wasn't going to win, the battles can drag on since the AI sometime is fast, othertimes It's like Internet Explorer making a turn. Getting wiped just to fight the same long tedious fight drags on, trying multiple strats just to get perma stunned by 5+ enemies. The wide variety of spells and weapon types means you have to adjust based on the enemy, with some damage types healing them, (my best weapons healed the final boss, that was fun).

Locales/Vibes- locations looked great, it felt like an adventure, from simple beaches (how original lol) to ancient caves and tombs to spirit realms & even to the ends of time. In the same vein some locations were terrible, like the Luculla Sandstorm,  nothing was fun about making a conga line with my party to pull the enemy, spending 20 minutes to beat a enemy then running away to escape combat and teleport away just to rinse and repeat. 
There are traps and secrets hidden in the world, things like hidden grave to lava traps.

Puzzles, some felt fun and rewarding, while the majority were just annoying and killed the pace and fun of the game, You'll need to be used to separating your party and multi-tasking with them, along with reading everything ever. Or needing very ""specific"" weights needed on weight plates. Many of them feel like they're trying to be overly clever and are doing too much imo. 

This is the kind of game where you need to interact and talk with everyone and everything, which takes forever. Even then you'll still miss things and interactions. If only I realized my choices in events that gave my character points in their personality things like ""vindictive, pragmatic, romantic"" etc actually affected my character stats and potential dialogue options that could lock you out of things. Along with knowing what items can actually be dragged onto others to work.

To me, this game would make one do new runs over and over to fix their mistakes if they get softlocked. So yeah you could respec everything except personality points from dialog and benefits/detriments, but what if you lose your skills? So what if i can buy them again or craft them again except the skills for my Knight and ranger? Ones that can't be gotten again? I committed to my build and mistake and suffered for it. Some skills felt useless and were a waste of precious talent points. My rogue had near max stealth skill, and I was still getting discovered, so I just used his ""Make Invisible"" skill which actually worked and was 1000x better.

Quick Side note, Don't sell Tenebrium items to merchants, I then had to deal with dying merchants for the rest of the game, I kept alive with my mage spamming Rejuvenates.

An annoyance to me was near the end game, I couldn't progress past a door needing me to have Blood stone/Star Stones, story/lore items that also double as ""full party heals"" basically omega tier heals. It said I didn't have enough but I already went everywhere I could ingame. So there I was backtracking the whole game searching high and low for these supposed stones. I found one, the only last one, but he still wouldn't open. How was I supposed to know I needed to use my rare healing stones? Then after that go to my homebase to talk to some merchants for the door to then open saying I was then worthy.

While I did enjoy my time with this game, those moments were here and there bogged down by slow moments, overtuned encounters, overly annoying puzzles, slow combat and general shenanigans one would expect from this style of game. Again I say to better enjoy the game, it'd take multiple runs/attempts. It'd be more fun for me now that I know how it plays out and how to spec better. I'd recommend it to people who like this type of game and difficulty, however to the casual RPG gamer who just wants to have easy fun without thinking, no stress kind of thing, this isn't for you.",False,0,1,1760780429
Divinity Original Sin,230230,0.0,0,solo/multiplayer/co-op,"Adventure, Indie, RPG, Strategy",76561198280936312,"I didnt really like it, it seems like step down from BG2, the story didnt intriguing and feel more exposition dumping. Didnt like how the quest dialoque is written, feel like the character say a lot but end up say nothing. didnt like the fact this is linear game but masked like open world, the enemies not respawning so you just following straight line, meaning have to planning before-hand, putting wrong skillpoint will doomed your whole playthrough, so combat is your only playstyle, cant go rogue cant do rp, because end boss always hard. with a game that farming is not possible due to enemies not respawning, then doing RP is pointless, why even put trait/karma system in linear game? Its blurry the focus of the game. Planning to finish this and play EE next, heard both of them have different quest and spell, but idk if i can even finish this one. The world is in verge of war but somehow the game painted it so bright and dandy, not clicked on me.",False,2,0,1756608665
Divinity Original Sin,230230,0.0,0,solo/multiplayer/co-op,"Adventure, Indie, RPG, Strategy",76561198002485475,"interesting rpg but i prefer divinity original sin 2. original sin is a very fleshed out and self contained story, but I didn't feel like that story ever did enough to capture or hold my interest to finish it. the combat is pretty weak and if you look around at all, you will quickly stumble on an encounter that is impossible at your current level. it feels less like ""dont go there"" and more like ""dont go anywhere,"" and you wont. I thought i never made it far enough to pass the starter town, but it turns out, thats the only town. everything is greatly improved in the sequel, which makes this entry obsolete for me and i have very little love for it. its not horrible, its just not as open as its disparate systems have the potential for.",False,2,0,1746606247
Divinity Original Sin,230230,0.0,0,solo/multiplayer/co-op,"Adventure, Indie, RPG, Strategy",76561198065187325,"So get this, its a roleplaying game that gives you the choice between being good or bad with lockpicking skills, smokescreens, a sneaking and stealing system, but if you decide to roleplay an evil and resourceful character, then you may use your shovel on the first ""suspicious mound"" you come across. Youre even encouraged by some intriguing descriptions of soiling a fresh grave and a +heartless indicator over your heads. When suddenly BOOM PARTY WIPE NO YOU DONT GET TO ROLEPLAY IN THIS ROLEPLAY GAME, gravedigging big bad crime and lovely developers are going to add the option to what, make you deal with their shitty autosave as punishment? Oh, which in case you didnt know, the autosave doesnt activate after extensive menu juggling so if you just explored half a city, completed a quest, and spent an HOUR JUST FIDDLING WITH THE CRAFTING SYSTEM, congrats, THAT HOUR WAS WASTED because you couldnt remember which FUNCTION BUTTON the quicksave was bound to and figured the game wouldnt have a nonfunctional autosave system in place- WRONG AGAIN FUCKO. Feels like playing dnd with a dm that will happily wipe the whole party because he doesnt like that the characters did an ""evil"" action or refreshes the browser so the combat data is lost because you landed a crit on his cool new bad guy or spent too long minmaxxing HIS OWN GAME. IM GOING TO FINISH THIS GAME AS EVIL AS POSSIBLE NOW OUT OF SPITE. You wanted to show me an experience but what you did was took my money and spat in my mouth and instead of thanking you IM GOING TO GO FUCKING FERAL. ALSO IM REBINDING AUTOSAVE TO MIDDLE MOUSE BUTTON

TLDR; Game is player unfriendly with botched features",False,3,6,1737848354
Divinity Original Sin,230230,0.0,0,solo/multiplayer/co-op,"Adventure, Indie, RPG, Strategy",76561198008466592,This entire series is just shitty Baulder's Gate 1 and 2. Play those instead.,False,1,1,1737217583
Divinity Original Sin,230230,0.0,0,solo/multiplayer/co-op,"Adventure, Indie, RPG, Strategy",76561198309363284,"Divinity Original Sin, or as I like to call it, ""Dipshit Original Sin"" is a fucking dumpster fire of a game that makes me want to rip my hair out and scream into the void. This game is a fucking insult to RPGs everywhere, and I'm pissed off just thinking about the hours I wasted playing this steaming pile of garbage.",False,3,3,1736789353
Divinity Original Sin,230230,0.0,0,solo/multiplayer/co-op,"Adventure, Indie, RPG, Strategy",76561198124180065,"i have alway found it incredible how larian studio is inccappable to balance its encounters in game. its a fucking miracle that its product are successfull at all.

there just isn't enough quest and mods to get your xp up so you end up as a lvv 4 party against lvl 6-7-8 groups of mobs (ended up 4 lvl 4 player character against up to 12 lvl 8 mob )  this game is hot garbage",False,4,4,1733642620
Divinity Original Sin,230230,0.0,0,solo/multiplayer/co-op,"Adventure, Indie, RPG, Strategy",76561199444545184,"Don't get me wrong, I love this game. However Its bugged. My first play through essential side quest items wont drop. Now this wouldn't be a big deal however when they did drop they would replace essential main quest items making it so I couldn't progress the story. Just play Divinity: Original Sin Enhanced Edition since its the same game, but less bugged, and more content.",False,4,0,1729097448
Divinity Original Sin,230230,0.0,0,solo/multiplayer/co-op,"Adventure, Indie, RPG, Strategy",76561198010944030,I hate this game,False,0,5,1728012077
Divinity Original Sin,230230,0.0,0,solo/multiplayer/co-op,"Adventure, Indie, RPG, Strategy",76561198093213295,"Great game, but purchasing it brings the Enhanced Edition along. [b]That version is less prone to bugs, is fully voice-acted, and comes with a ton of balacing changes, additions, and improvements[/b]. So I'd say to only play this Classic version in case something is preventing you from playing the Enhanced one. ",False,14,3,1727880978
Divinity Original Sin,230230,0.0,0,solo/multiplayer/co-op,"Adventure, Indie, RPG, Strategy",76561198052606994,"Simply because I don't support a55holes. You put a picture of two blindfolded source hunters in honour mode and put traps with one hit kill that is not possible to avoid. Without meta gaming. I literally DO NOT care how good your product is, if you're an a55hole, you get review for a55hole",False,1,2,1727172946
Divinity Original Sin,230230,0.0,0,solo/multiplayer/co-op,"Adventure, Indie, RPG, Strategy",76561198006321535,I always wanna play this game but the character models look like chudulons,False,1,0,1708445398
Divinity Original Sin,230230,0.0,0,solo/multiplayer/co-op,"Adventure, Indie, RPG, Strategy",76561198989761658,"One of the worst, most overrated rpg's of all time.

Horrible combat
bad graphics
terrible story
non stop gimmick encounters
just a terrible game, people have low standards today so they like these games.

All this can apply to DOS 1 or 2, the only difference is dos 1 is stupid and dos 2 is tryhard and cringe when it comes to writing",False,1,0,1704459337
Divinity Original Sin,230230,0.0,0,solo/multiplayer/co-op,"Adventure, Indie, RPG, Strategy",76561199062013627,"The second game was slug bs and this one even worse haha
I totally don't recommend for people who are weak and not true RPG nerds.
For me this is painful experience I have to do anyway.
",False,0,1,1703529182
Divinity Original Sin,230230,0.0,0,solo/multiplayer/co-op,"Adventure, Indie, RPG, Strategy",76561197981539699,No thx another greedy price hike....,False,1,0,1698251582
Divinity Original Sin,230230,0.0,0,solo/multiplayer/co-op,"Adventure, Indie, RPG, Strategy",76561199059169580,"This product is not compatible with macOS 10.15 Catalina or above. Click here for more information.
Thank you, see you later (never).",False,0,0,1697975036
Divinity Original Sin,230230,0.0,0,solo/multiplayer/co-op,"Adventure, Indie, RPG, Strategy",76561198089824398,"save file gone, guess i didnt want to finish my run anyway",False,0,1,1696518375
Divinity Original Sin,230230,0.0,0,solo/multiplayer/co-op,"Adventure, Indie, RPG, Strategy",76561199021608877,"Maybe this game was fun back in the old days, but it just isn't fun.  Annoying sound, goofy mechanics, absolutely no way to find out what or where you're supposed to go.  Now I'll try D:OS2 to find out if they fixed it.",False,0,0,1667614207
Divinity Original Sin 2,435150,44.99,0,solo/multiplayer/co-op,"Adventure, RPG, Strategy",76561198263423076,"This was my first time playing a CRPG, and thanks to this game, I completely fell in love with the genre. The freedom and possibilities it offers are incredible, letting me tackle challenges and shape the story in so many ways. The story itself is captivating, full of twists and meaningful choices. My companions quickly became more than just allies. Their personalities, humor, and struggles made me genuinely care about them, and over the course of the game our bonds grew so strong that I truly enjoyed every interaction with them.",True,0,0,1764176994
Divinity Original Sin 2,435150,44.99,0,solo/multiplayer/co-op,"Adventure, RPG, Strategy",76561197967683697,"Would definitely play again! Had a world of fun, love Larian <3",True,0,0,1764153281
Divinity Original Sin 2,435150,44.99,0,solo/multiplayer/co-op,"Adventure, RPG, Strategy",76561199006870960,"This game is pretty good.  Its gameplay is interesting, and the abilities are truly unique in many cases.  I also enjoy there is a lot of versatility in what builds players can make and what builds can go well together.  The characters are compelling, and the story is engaging (although it might take some time to start up if you are not familiar with the franchise).  It can be a little difficult to start up given how different this game is from others like it.  Once the economy of the game is understood, and the armor/CC mechanics, the game is really fun.  
The only real downside I would report is the magic, which will at times lead to damage being delt that was not intended.  That being said, this is not often an issue, mostly a nuisance.",True,0,0,1764124591
Divinity Original Sin 2,435150,44.99,0,solo/multiplayer/co-op,"Adventure, RPG, Strategy",76561198798553512,"One of the good Game, i played.",True,0,0,1764115555
Divinity Original Sin 2,435150,44.99,0,solo/multiplayer/co-op,"Adventure, RPG, Strategy",76561199208031022,Storyline gameplay graphics,True,0,0,1764109788
Divinity Original Sin 2,435150,44.99,0,solo/multiplayer/co-op,"Adventure, RPG, Strategy",76561199522293483,It's the bomb! Can't wait to try out Baldurs Gate 3 after this later on.,True,0,0,1764107706
Divinity Original Sin 2,435150,44.99,0,solo/multiplayer/co-op,"Adventure, RPG, Strategy",76561198123721210,my  tail clips through things too much but the lizards are really cool,True,1,0,1764101972
Divinity Original Sin 2,435150,44.99,0,solo/multiplayer/co-op,"Adventure, RPG, Strategy",76561197975890539,arcade baldurs gate 3. the only thing it lacks is an alignment tracker of your evil deeds making the games ending really weird unless killing everybody really did save them?,True,0,0,1764066606
Divinity Original Sin 2,435150,44.99,0,solo/multiplayer/co-op,"Adventure, RPG, Strategy",76561198069077060,probably better then baldurs gate,True,0,0,1764048275
