game_name,app_id,price_usd,age_rating,game_mode,genres,user_id,review_text,voted_up,votes_helpful,votes_funny,created
Cyberpunk 2077,1091500,59.99,17,solo,RPG,76561198442963435,"It is a great game, but does require a powerful hardware to play. My Steam Deck Oled can play it but I got killed by mini-bosses and I had to play from PS5 to pass them. For easier missions it is playable also from the deck, but I wouldn't chase Adam Smasher from that device.",True,0,0,1764184083
Cyberpunk 2077,1091500,59.99,17,solo,RPG,76561198278858895,this game is dangerous to play during finals week,True,0,0,1764182495
Cyberpunk 2077,1091500,59.99,17,solo,RPG,76561199013206899,"If you havent played this game yet and are sitting there questioning giving it a go, DO IT. This is one of the best things in MEDIA, its easily in my top 3 games of all time and if this game was a movie it would be in that top 3 as well. Simply, PLAY IT, YOU WONT REGRET A THING!

Also for the people worried about the bugs and glitches and what not, I have personally encountered a few bugs with the main one being game crashes, but overall, the crashes are so irregular and the game autosaves anyway so most of the time progress wont be lost and just remember to manually save, and plus, the game can crash all it wants in my opinion, the game is that good id let it have sex with my wife.

PLAY IT, BUY IT, NOW!!",True,0,0,1764179557
Cyberpunk 2077,1091500,59.99,17,solo,RPG,76561198877752686,"It's a good game. It has:
- good graphics
- many missions (very fun)
- interface and mechanics
- game world
My final rating is 9/10",True,0,0,1764178786
Cyberpunk 2077,1091500,59.99,17,solo,RPG,76561199575292978,The graphics in Cyberpunk 2077 are stunning and the story is rich and beautifully narrated. Every detail from the themes to the gameplay is so immersive.,True,0,0,1764178225
Cyberpunk 2077,1091500,59.99,17,solo,RPG,76561199100876011,"goon material
",True,0,0,1764177341
Cyberpunk 2077,1091500,59.99,17,solo,RPG,76561199633567144,The best game ever,True,0,0,1764174291
Cyberpunk 2077,1091500,59.99,17,solo,RPG,76561198130678974,"Masterpiece

Add Always First Equip mod in vanilla please. Can be a toggle in settings. Its a shame to hide such beautiful animations. Can't enjoy them when playing through GFN.",True,0,0,1764171829
Cyberpunk 2077,1091500,59.99,17,solo,RPG,76561198091134431,"The gameplay, the story and all visual effects are amaizing.",True,0,0,1764169946
Cyberpunk 2077,1091500,59.99,17,solo,RPG,76561198858213452,do i even need to explain?,False,0,1,1764175861
Cyberpunk 2077,1091500,59.99,17,solo,RPG,76561197989758447,"Developers been playing with their own genitals too much. The entire prelude interlude rubbush, clicking Y and F over and over and over for over ten minutes to get through that self serving ego rubbish, by far the worst sequence I have ever gone through, that alone makes the game do not reccomend because it would make a second play through totally undesirable vomit churning rubbish. Why are some developers so screwed in the head, to think zero game play sequences make game play good.",False,1,3,1764161914
Cyberpunk 2077,1091500,59.99,17,solo,RPG,76561198055387588,You cant hit kids,False,2,1,1764140884
Cyberpunk 2077,1091500,59.99,17,solo,RPG,76561199065822438,"I have a RTX 4080 and ryzen 7900x 32gb of RAM, so what I consider to be a pretty powerful PC, and this game crashes CONSTANTLY. I have tried rolling back GPU drivers as well as going back to previous versions of the game, I have messed with every setting in and out of game imaginable yet I cannot for the life of me get the random crashes to stop. I have spent the 7 hours I have on this game messing with settings and re-doing the prologue due to being unable to save.",False,0,0,1764140625
Cyberpunk 2077,1091500,59.99,17,solo,RPG,76561199014787183,"Sorry for all the new players trying to play cyberpunk today because CD Projekt Red (Arasaka sympathizers)

Decided to go cyberpsycho and add a new forceful user agreement where you can't play their game without agreeing to allow a spyware program to run in the background while you play, so you can't mod your game or do anything to alter the game in any way (It's a single player game who cares)",False,2,1,1764133041
Cyberpunk 2077,1091500,59.99,17,solo,RPG,76561198215581492,"Cyberpunk 2077 is fine, I think. Probably one of the most 6/10 games I have ever played. It has a lot of side content, and there is definitely fun to be had, but it is more so in the Fallout 3 way of making your own fun. The cyberware feels half-baked, the perk system still feels like a first draft, melee feels basically unusable at higher difficulties, the writing is either pretty decent or just abysmal, a lot of the quest design is pretty boring and underdeveloped, the main quest ends right as it seems like it is about to get really interesting, and the city itself feels flat. It's got a lot of pretty buildings to look up at, but there is basically no meaningful verticality that the game plays with. At full price, I can not in good faith recommend the game. 

Phantom Liberty is a little better, I would probably rank it independently at around a 7/10 or maybe an 8/10, but that is mainly just because the writing and quest design is better and a lot tighter than the main game. The fundamental gameplay just does not feel good. Still pretty buggy, still a pretty bad ""roleplaying game"", and still a very superficial exploration of the themes of cyberpunk.",False,0,1,1764118135
Cyberpunk 2077,1091500,59.99,17,solo,RPG,76561198409556170,it just feels like nothing,False,0,0,1764057517
Cyberpunk 2077,1091500,59.99,17,solo,RPG,76561199133458254,"Cannot play this game without it silently crashing after the first 20-30 minutes unfortunately. Have tried many, many, many times with many, many, many different settings and fixes applied.",False,1,0,1764029789
Cyberpunk 2077,1091500,59.99,17,solo,RPG,76561198808660076,"If you like stories you might like this game but it really wasnt for me and I seriously cannot recommend this game to anyone. The gunplay feels weak, the cars are lame (though they look cool), and there's like nothing to do in night city. Speaking of night city: the map is increadibly boring and every corner of it feels the exact same. 

so yeah, not for me, but you might enjoy it idk",False,0,1,1764007806
Cyberpunk 2077,1091500,59.99,17,solo,RPG,76561198308139892,"i put 100 hours into this game and now it decides to crash crashes every time it saves or autosaves. reinstalling the game, updating drivers, starting a new game and deleting save states didnt fix it at all. its unplayable",False,0,0,1763962647
Cyberpunk 2077,1091500,59.99,17,solo,RPG,76561198137695918,"Honestly, Cyberpunk ended up being way more talking and driving than actual action. Kinda feels like I should’ve just watched the anime instead and saved myself the trouble of playing the game",False,0,1,1763962506
Cyberpunk 2077,1091500,59.99,17,solo,RPG,76561198355025100,"Even after they fixed all of the bugs, the game is just bad, no way to slice it. The driving Physics is so unpredictable, especially during cut scenes, the story is not explained well, and the dialogue lines are some of the worst I have ever heard. All of the characters say the most obvious and cringiest things imaginable. I couldn't even make it 2 hours into the game.",False,1,0,1763946462
Cyberpunk 2077,1091500,59.99,17,solo,RPG,76561197993855291,"It pains me to dislike it as it truly is nice, a great idea, story/ies...
But despite 300 patches the game is still terribly bugged...Incredible you would release such a AAA game with so many flaws, what were they thinking",False,0,0,1763942633
Cyberpunk 2077,1091500,59.99,17,solo,RPG,76561197996134660,"The game crashes too often for me with this error:
Faulting application name: REDlauncher.exe, version: 4.3.0.2, time stamp: 0x68da8337
Updating the launcher (I absolutely despise launchers for this reason) and reinstalling it does not help.
",False,1,0,1763939551
Cyberpunk 2077,1091500,59.99,17,solo,RPG,76561199164147138,cheap ass mobile game controls,False,0,2,1763915972
Cyberpunk 2077,1091500,59.99,17,solo,RPG,76561198141902208,"Boring and janky. Glorified Eurojank. Unfortunately, because it starts with a good setup and the setting seems interesting. Gameplay is not satisfying in the slightest, there are indie games with better mechanics and feel out there. Story-wise the game is extremely expositive, which breaks the immersion and makes the dialogues feel a little bit artificial.",False,0,0,1763915598
Cyberpunk 2077,1091500,59.99,17,solo,RPG,76561198016275940,Not a bad game but became rather quickly repetitive and boring. There are other games out there than do a better job.,False,1,0,1763903003
Cyberpunk 2077,1091500,59.99,17,solo,RPG,76561198275005082,"something about this game has it crashing constantly with AMD driver software. 
I don't have this problem with any other game, but it's completely unplayable as it is.
Considering AMD is a major gaming rig utility, I really hope this gets fixed.
I haven't even bought and played phantom liberty yet :/

I'll change my review if this gets fixed. I'm incredibly disappointed bc I love this game.",False,8,3,1763892470
Cyberpunk 2077,1091500,59.99,17,solo,RPG,76561198882972098,"Tried really hard to get through this game, but there's simply not enough Player Agency.

What I mean by that, is that most of the presented dialogue choices are things that I would personally never say as V. So it's very hard to ""self-insert.""",False,0,2,1763885565
Mortal Shell,1203620,29.99,0,solo/multiplayer/co-op,"Action, Adventure, Indie, RPG, Early Access",76561198078249031,Good cozy game.,True,0,0,1764184810
Mortal Shell,1203620,29.99,0,solo/multiplayer/co-op,"Action, Adventure, Indie, RPG, Early Access",76561198030927252,"A great game with a gorgeous world. Thanks to extensive gameoptions it can be as easy or as difficult as you want.

The only thing that can get frustrating are some of the doorpuzzles, but Google or Youtube can help with that.",True,0,0,1764184261
Mortal Shell,1203620,29.99,0,solo/multiplayer/co-op,"Action, Adventure, Indie, RPG, Early Access",76561199823654550,"The most beautiful and addicting game I have played in a long time. Whether you want to relax, or focus on travelling to an untouched tomb; there is always something fun to do. If you are looking to build a beautiful base(s), there are so many different options; and endless ideas! This is the most fun I have had for years, playing enshrouded, and exploring the vast world.",True,0,0,1764183263
Mortal Shell,1203620,29.99,0,solo/multiplayer/co-op,"Action, Adventure, Indie, RPG, Early Access",76561198082584882,If you love building and exploring you will love this game,True,0,0,1764183161
Mortal Shell,1203620,29.99,0,solo/multiplayer/co-op,"Action, Adventure, Indie, RPG, Early Access",76561198307390087,perfect game so much to do and great co op,True,0,0,1764182930
Mortal Shell,1203620,29.99,0,solo/multiplayer/co-op,"Action, Adventure, Indie, RPG, Early Access",76561198025971058,"Enshrouded is the game that keeps giving, the updates has always been great. Jumping back in everytime a new update comes out is always fun. 
Game is best played with friends.",True,0,0,1764182806
Mortal Shell,1203620,29.99,0,solo/multiplayer/co-op,"Action, Adventure, Indie, RPG, Early Access",76561198018542616,"its alright, they come out with updates periodically.  They can't balance weapons and armor for some reason.  They make you fish, which sucks",True,0,0,1764181215
Mortal Shell,1203620,29.99,0,solo/multiplayer/co-op,"Action, Adventure, Indie, RPG, Early Access",76561199376134354,good game :D,True,1,0,1764180984
Mortal Shell,1203620,29.99,0,solo/multiplayer/co-op,"Action, Adventure, Indie, RPG, Early Access",76561198142300047,Best game ever,True,0,0,1764180951
Mortal Shell,1203620,29.99,0,solo/multiplayer/co-op,"Action, Adventure, Indie, RPG, Early Access",76561198092304413,"Combat system and progress system in this game is outright aweful . Stamina is GONE in one second of fight animations are totally LOCKING you in place you cant do anything, skill tree is mostly useless .. They say PARRY them yes go and parry 5 mobs at the same time each area in this game has massive amount of mobs which each can kill you in 2 hits .. Unless you are 5-7 levels above those monsters which you in most of the time are not . 
Next really stupid decision is how armors works or lets say they dont work they are outright crime .. first you cant find any armor which is better that you can craft after 30 hours i have GOTTEN nowhere because its constant RETURN here and there for your dead body ...",False,0,0,1764156563
Mortal Shell,1203620,29.99,0,solo/multiplayer/co-op,"Action, Adventure, Indie, RPG, Early Access",76561198027325894,"8/10 exploration, base building, and crafting but the 3/10 combat just drags the whole game down. I keep trying to pick it up again but every time I have to fight (you know like 50% of any survival crafter) I just get frustrated. I can’t even convince myself to play, how can I recommend it to others?",False,0,0,1764154890
Mortal Shell,1203620,29.99,0,solo/multiplayer/co-op,"Action, Adventure, Indie, RPG, Early Access",76561197983852484,"There are definitely mechanics you can enjoy, but personally they missed the mark.

Movement is a little too floaty, feeling similar to ARK.
The skill tree feels like it should be split up so basic survival skills (e.g mining/chop speed) are not taking away from the more fun skills.
At least early on, the game does not feel great in terms of scaling to a larger group. We tried with 6 people  and there is a constant blast of information as people unlock things or talk to NPCs, and it feels silly just whacking every enemy in a 6v1 fight.
And the biggest problem was performance stability, for most of our group even with low settings FPS would regularly dip below 30.",False,1,0,1764152120
Mortal Shell,1203620,29.99,0,solo/multiplayer/co-op,"Action, Adventure, Indie, RPG, Early Access",76561198273388239,"The start felt too much like Fortnite the survival game, in the worst way...I wanted to enjoy this game but I feel like there is not enough there to grab you at the start and I didn't want to keep the game to find out if it would grow on me so i refunded it.
I also feel like this game suffers a lot if you try and play it with too many players, I felt overwhelmed with pop-ups and didn't really know if I should be focusing on questing, exploring or survival.
Also my friends were struggling with performance a lot even after trying to make the game look like a fogged up mirror, so that is something to consider if you don't have a high end PC.

This game might become great when you progress but it's an expensive game to keep with hopes of enjoying it later.",False,2,0,1764149797
Mortal Shell,1203620,29.99,0,solo/multiplayer/co-op,"Action, Adventure, Indie, RPG, Early Access",76561198000021622,"too early, no novelty, wish I could get a refund",False,0,0,1764136722
Mortal Shell,1203620,29.99,0,solo/multiplayer/co-op,"Action, Adventure, Indie, RPG, Early Access",76561197971582421,"Not worth it in it's current state. I know it's Early Access, but holy moly is this ever rough around the edges. A lot of basic tutorials that you'd expect to get are simply not there, and the AI is pretty much ""run in straight line and attack, repeat"" for every enemy- which can still be difficult because enemies are often just spammed at you from spawners you can barely see and any attacks from behind count as backstab, even for enemies. So an enemy you didn't even know had spawned behind you can one shot you.

Which brings me to my next major gripe:  Darksouls style artificial difficulty.  Some traps and even simply existing in some areas will INSTANTLY KILL YOU. With no warning or indication whatsoever. The worst being the Shroud itself. The game doesn't tell you there are multiple ""levels"" of shroud, which to the player just looks like fog. There is no distinction between levels apparently. So you can be walking through shroud and be fine, then simply touch a higher level shroud and just instantly die. Insult to injury is that the game flashes a message on your screen warning you that you're IN a harder shroud area. *After* you are dead.

Being a caster is kind of a joke, as staffs require mana AND ammo, which is a huge pain in the ass to get mats for early on. Then there's the game's automatic target locking. You can't freely aim, you are stuck locking onto enemies and it can seriously screw you over if you're trying to shoot a barrel next to an enemy because. While I only found out later you can hold T and it will cancel target lock but only while holding T. There's permanent toggle.

The game has promise, but in it's current state, it is more frustrating than fun to play. Way too many annoying ""choices"" that bring the game down.",False,0,0,1764133699
Mortal Shell,1203620,29.99,0,solo/multiplayer/co-op,"Action, Adventure, Indie, RPG, Early Access",76561198855145424,"I LOVED IT AT FIRST but after 25 hours of playing with my fiance, the latency in the server started having massive spikes non stop to the point the lag makes the game unplayable for me :(",False,1,0,1764132200
Mortal Shell,1203620,29.99,0,solo/multiplayer/co-op,"Action, Adventure, Indie, RPG, Early Access",76561199142909025,"Absolutely fucking trash development team. The early game requires hours upon hours of gameplay just to progress to level 10, and that isn't even enough to feel like you can enjoy it. The movement is garbage and half ass responsive. I have more fun kicking myself in the balls. The only good thing about this game is the building, and it's not worth the headache it comes with",False,0,0,1764123728
Mortal Shell,1203620,29.99,0,solo/multiplayer/co-op,"Action, Adventure, Indie, RPG, Early Access",76561199243904809,Empty and soulless game. Valheim is miles better.,False,0,0,1764119860
Mortal Shell,1203620,29.99,0,solo/multiplayer/co-op,"Action, Adventure, Indie, RPG, Early Access",76561198187363517,"The performance optimization is still painfully garbage almost a year after I bought the game. I keep dropping it and telling myself ""they'll probably fix it in a couple months"", but at this point I don't know if that's ever going to happen. There's no reason this game should be running at sub 60FPS using medium to medium-high settings (With DLSS on performance), on a device with a core ultra 9, RTX 4080, and 32GB RAM. 

If these issues ever do get addressed, I can easily see myself putting in over a hundred hours in this game, but at it's present state, it just gives me a headache.

I'd say hold off on buying until the game is finished.",False,0,0,1764119846
Mortal Shell,1203620,29.99,0,solo/multiplayer/co-op,"Action, Adventure, Indie, RPG, Early Access",76561197984425770,"The game is not optimized and it runs at less than 30 fps and that's after setting everything to highest performance.    I can play Horizon at almost 60 fps yet for Enshrouded we need some kinda NASA computer?   No, until developers will eliminate shader compilation and improves enormously its graphics optimization (so it runs on normal computers) the game remains unplayable.",False,0,0,1764113481
Mortal Shell,1203620,29.99,0,solo/multiplayer/co-op,"Action, Adventure, Indie, RPG, Early Access",76561198017491251,melee sucks so bad.  you can just play range or mage and kill stuff so much faster,False,1,0,1764111134
Mortal Shell,1203620,29.99,0,solo/multiplayer/co-op,"Action, Adventure, Indie, RPG, Early Access",76561199152374496,The Blackmire ancient Spire tree jumping is extremely hard. I have tried it with the glider and without. Some of the jumps work the way you think they should and then one will just jump short even on a double jump.  I'm sure it can be done but it would be nice if there was a way to not start at the bottom or die from the fall every time you miss a branch.,False,0,0,1764109909
Mortal Shell,1203620,29.99,0,solo/multiplayer/co-op,"Action, Adventure, Indie, RPG, Early Access",76561198017052567,"Officially done with this game. I loved playing it... until this water update, where they started nerfing players' builds across the board. With the latest patch, they essentially added even more nerfs, this time cutting damage perks on weapons in half. The game isn't fun anymore. I'm dying more than anything else when previously my level 35 mage FELT like a level 35 mage. And before any of this game's fanboys say ""then change your settings"", I'm going to pre-emptively counter with ""I shouldn't be having to change world difficulty settings mid-playthrough just to keep the same difficulty level those same zones had previously"".",False,0,0,1764108346
Mortal Shell,1203620,29.99,0,solo/multiplayer/co-op,"Action, Adventure, Indie, RPG, Early Access",76561198044668987,"Recent updates completely ruined performance.

I went from running fine to like 3 fps with everything on super low.

I wish Steam would perma ban any dev that does that.",False,0,0,1764094859
Mortal Shell,1203620,29.99,0,solo/multiplayer/co-op,"Action, Adventure, Indie, RPG, Early Access",76561199273819570,Im sorry but i just don't like it,False,0,0,1764081838
Mortal Shell,1203620,29.99,0,solo/multiplayer/co-op,"Action, Adventure, Indie, RPG, Early Access",76561198048938560,still find this laggy with a decent gpu and high ram and a ryzen 9. every game i got i can play max settings with ray tracing and all that yet this is the only 1 that is on low and still lags!,False,1,0,1764075605
Mortal Shell,1203620,29.99,0,solo/multiplayer/co-op,"Action, Adventure, Indie, RPG, Early Access",76561198134594082,The game was playable for me till this newest update now the performance is just terrible and it makes the game unplayable hopefully they can sort this out really enjoyed playing,False,0,0,1764071558
Mortal Shell,1203620,29.99,0,solo/multiplayer/co-op,"Action, Adventure, Indie, RPG, Early Access",76561198065092503,30-40min compiling shaders every graphics card update sucks big D.Was an awesome game till that issue started happening.Cant recommend till it's fixed,False,0,0,1764057650
Dolmen,1283400,49.99,17,solo,"Action, Adventure, RPG",76561199788653645,"I actually loved this game. It's not as Dark Soul's like as I initial had thought, but that's not a bad thing in this case. Any Elden Ring/Dark Souls players will have an easy time with this game. I beat the last 4 bosses without a single death and that made me feel just as powerful as you should in a game where you're essentially the perfect automaton fighting a mass produced army.

Also I'd like to say that the story is A-Tier for me, the world is unique being in France during the reign of King Louie XVI and Marie Antoinette, and the addition clock work robots as the main character and enemies made this a unique experience. But as I said the story was pretty fun, no crazy plot twists or crazy revelations but just straightforward plot development which is not always in action heavy games.",True,0,0,1763936792
Dolmen,1283400,49.99,17,solo,"Action, Adventure, RPG",76561198803912352,"This game is tagged as souls-like, but if it is, then it' a very generous souls-like. Can you imagine souls-like with infinite stamina (if built right) and infinite usages per item(as many as you can buy/collect))?
Overall, recommended if in discount, since it was released a while ago, no point of buying it full-price unless it's masterpiece, which this one is not.",True,0,0,1763905930
Dolmen,1283400,49.99,17,solo,"Action, Adventure, RPG",76561198101551455,"Pretty good game overall, I'd recommend if you are looking for a soulslike that is short, has a fun story, and decent combat. 
I will say, the story is by far the strongest part of this game. I also really like that the devs tried a new spin on the genre, by adding interesting movement abilities. However, the levels were a bit too simple to really let these shine (even when backtracking, these abilities were used in pretty simplistic ways). 
The combat was okay, there were only a couple of weapon types (though they came with different special attacks, they were largely the same). The enemy variety was good considering the short runtime. 
The combat overall was really easy even w/o the assist mode. The bosses were a letdown - they were incredibly easy, and didn't really have any moves or combos to worry about. Also, their attack hitboxes were *really* bad - a lot of them you could just hug and they'd not be able to hit you with most of their attacks.
As a complete package, this is a fun game for the ~15hr runtime (not incl DLC). However, get it on sale, it is far too expensive at full price for what you get. But at ~$10, this game is a pretty fun time.",True,0,0,1763789235
Dolmen,1283400,49.99,17,solo,"Action, Adventure, RPG",76561198350455061,"good game. 7/10, french revoltion but with soul eating robots.",True,0,0,1763662041
