game_name,app_id,price_usd,age_rating,game_mode,genres,user_id,review_text,voted_up,votes_helpful,votes_funny,created
Risk of Rain 2,632360,8.24,0,solo/multiplayer/co-op,"Action, Indie",76561198212673491,"For a while now, the music doesn't work at all on the Steam Deck. This used to be fixed by un-checking the force a specific proton version for game compatibility in the properties settings and then updating everything in the updates tab for Flatpak within desktop mode. I have looked everywhere, and there's no more solutions. I also checked the bug reports and the developers don't pay attention to them. Controller support also is a mess on Linux due to bugs. ROR2 is a good game when it has no bugs, but if Gearbox won't get any more bugs fixed, the game is going to turn back into the buggy mess that occurred with the Seekers of the Storm update.",False,0,0,1764042655
Risk of Rain 2,632360,8.24,0,solo/multiplayer/co-op,"Action, Indie",76561198007144747,Purchased DLC just to find out that my profile with everything unlocked had been completely destroyed and no matter what I tried I could not recreate it. 0/10 devs go F*ck yourselves.,False,0,1,1764039525
Risk of Rain 2,632360,8.24,0,solo/multiplayer/co-op,"Action, Indie",76561199135770457,"so fucking retarded and IS the MOST overrated game on steam. overwhelmingly positive for this lump of shit? really?
",False,0,0,1764038315
Risk of Rain 2,632360,8.24,0,solo/multiplayer/co-op,"Action, Indie",76561198992733999,alloyed broke a bunch of stuff and is really bad.,False,0,0,1764038095
Risk of Rain 2,632360,8.24,0,solo/multiplayer/co-op,"Action, Indie",76561199116975586,hermit crab,False,0,0,1764025128
Risk of Rain 2,632360,8.24,0,solo/multiplayer/co-op,"Action, Indie",76561198274945841,THE GAMEPLAY LOOP IS TRASH,False,0,0,1764014689
Risk of Rain 2,632360,8.24,0,solo/multiplayer/co-op,"Action, Indie",76561199885127315,"if you want to truly waster your time while making no progress in a game, look no further than risk of rain. the game where you spent 45 minutes on a run, get one shot by something you cant even see, and have nothing to show for it. no level ups, no unlocks, no progress. you just have to start over. what a colossal waste of time. the start is way too slow, not enough enemies spawn and money takes forever to come across. time after time, run after run, i just end up mad because there are so many one shot enemies. ive never had a SINGLE run where im like ""wow, im glad i played risk of rain 2"" at the game over screen. just repeated bull crap deaths and nothing to show for it.",False,2,4,1763961279
Risk of Rain 2,632360,8.24,0,solo/multiplayer/co-op,"Action, Indie",76561198399219205,The campfire doesn't hurt you.,False,1,1,1763956490
Risk of Rain 2,632360,8.24,0,solo/multiplayer/co-op,"Action, Indie",76561198974223455,One of my all time indie games played it on console and now on pc a few years later however I can not recommend currently as the multiplayer has an issue with constant crashing it is only the multiplayer whole lobbies will randomly lag out and you are forced to force close and restart the game otherwise you are unable to use any of the menus I have never seen the servers get this bad,False,0,0,1763955350
Dead Cells,588650,24.99,0,solo,"Action, Adventure, Indie",76561198448978476,I am very bad at this game,True,0,0,1764176011
Dead Cells,588650,24.99,0,solo,"Action, Adventure, Indie",76561199470701874,"10/10 would sacrifice mushroom boi again

Great basic game + free DLC, and the other DLCs are absolutely worth it as well",True,0,0,1764174527
Dead Cells,588650,24.99,0,solo,"Action, Adventure, Indie",76561198390465366,400 h 'n only 2 dead ahh brain cells,True,0,0,1764173883
Dead Cells,588650,24.99,0,solo,"Action, Adventure, Indie",76561199248183464,"Dead Cells — Fast-Paced Roguelike Action at Its Finest

Dead Cells is a masterclass in tight, fluid combat and procedural design. From the very first run, the game hooks you with its fast-paced movement, responsive controls, and endless surprises around every corner. Every level feels alive, challenging, and meticulously crafted, keeping you on your toes while rewarding skill and experimentation.

Combat is both satisfying and strategic. Whether you’re slashing with swords, raining arrows from a distance, or experimenting with magical abilities, every encounter demands quick thinking and adaptability. The variety of weapons, abilities, and power-ups ensures no two runs feel the same, making every death feel like a learning experience rather than a setback.

The procedural levels are beautifully designed, blending consistency with unpredictability. You’ll explore sprawling castles, perilous biomes, and hidden areas, all teeming with enemies, secrets, and loot. Each run is a fresh challenge, keeping the game endlessly replayable.

Progression is rewarding and fair. Unlocking new weapons, mutations, and abilities encourages experimentation and creates a sense of growth across multiple runs. The game strikes a perfect balance between challenge and satisfaction, making every victory feel earned.

Visually, Dead Cells is stunning. Pixel art meets fluid animation in a style that’s both retro and modern. Coupled with an energetic soundtrack, the game’s atmosphere feels tense, vibrant, and utterly alive.

Final Verdict:
Dead Cells is a thrilling roguelike that combines fluid combat, clever design, and endless replayability. Challenging, rewarding, and endlessly fun, it’s a must-play for anyone who loves action-packed platformers and roguelikes.

“Fast, fluid, and endlessly rewarding — Dead Cells proves that roguelikes can be both challenging and exhilarating.”

Overall Rating: ⭐⭐⭐⭐⭐⭐⭐⭐⭐⭐ 10/10",True,0,0,1764167635
Dead Cells,588650,24.99,0,solo,"Action, Adventure, Indie",76561199390832326,"Absolutely amazing, the game has comfortable keybinds, it's got gorgeous graphics and the game is challenging but not too difficult. 8.5/10",True,0,0,1764113812
Dead Cells,588650,24.99,0,solo,"Action, Adventure, Indie",76561197976968955,"If you like Ori or Hollow Knight, and you also love roguelikes then this is the game for you. The progression is really consistent so dying doesn’t feel too frustrating. You’re always learning new biomes, enemies, and bosses. Over time you unlock new weapons, movement abilities, and upgrades. This is a great Steam Deck game.",True,1,0,1764101889
Dead Cells,588650,24.99,0,solo,"Action, Adventure, Indie",76561199162447210,"i don’t have that many hours of this game but i really love it. i always play it when i feel boring about other games like… this game never gets me bored, i always love to kill these monsters and get many kind of weapons. really got me excited so i really recommend it",True,0,0,1764068507
Dead Cells,588650,24.99,0,solo,"Action, Adventure, Indie",76561198266991019,"perfect gameplay and run well on low end devices. Played it first on game pass and love it, so i bought it on steam for my steam deck oled.",True,0,0,1764065690
Dead Cells,588650,24.99,0,solo,"Action, Adventure, Indie",76561199652606899,"King's Staff has [b]it's[/b] instead of [b]its[/b] in the item description, literally unplayable

(in all seriousness though, this is a fun game, force-enabling [spoiler]the Malaise[/spoiler] on lower difficulties using Custom Mode makes the game so much better, especially since it doesn't disable achievements)",True,0,0,1764031357
Dead Cells,588650,24.99,0,solo,"Action, Adventure, Indie",76561199185357853,Where the fuck is the 5th boss cell,False,0,0,1763827477
Dead Cells,588650,24.99,0,solo,"Action, Adventure, Indie",76561197961063433,If you run Linux this game does not support controllers. Trash,False,1,1,1763815795
Dead Cells,588650,24.99,0,solo,"Action, Adventure, Indie",76561198044393604,"The game is fun but the ads for the DLC  are insanely annoying. I found a secret area and was super excited to go there, but I got hit with a paywall saying I needed the DLC to continue further. Absurd!!",False,0,0,1762684339
Dead Cells,588650,24.99,0,solo,"Action, Adventure, Indie",76561199085496031,"Amazing potential cut short by a greedy dev civil war. DO. NOT. SUPPORT. MOTION. TWIN.

SUPPORT EVIL EMPIRE, THEY ARE THE TRUE DEVS OF THIS GAME!!!",False,3,0,1762572771
Dead Cells,588650,24.99,0,solo,"Action, Adventure, Indie",76561199555671477,Not sure what all the hype is about this game.,False,2,0,1762534454
Dead Cells,588650,24.99,0,solo,"Action, Adventure, Indie",76561198244139082,"Bought this game for dirt cheap many years ago and finally got around to playing it (it became part of that dreaded ""backlog"" we all have). 

It is a Rogue game. If you are someone that likes making progress in your games, values a story or actually progressing while playing, look the other way. This genre is terrible if any of the above things matter to you at all.

If however, you enjoy playing the same section of a game over and over again with no save points, no checkpoints, and the smallest mistake forces you to lose everything and do it all over again, this is a game for you!

I was interested in the art style and thought it played like classic side scrollers from ""back in the day"" but that is not the case. Apparently this genre is absurdly popular but having finally gotten around to actually trying this game, I don't understand the appeal. Roguelike and Roguelite are being added to my Steam tag exclusion list. 

This just isn't for me. Hopefully this review helps you make an informed decision but I guess I'm in the minority, it's overwhelmingly positive for some reason. Try it for a couple hours and if you're like me and hate it, refund it.",False,1,1,1762408360
Dead Cells,588650,24.99,0,solo,"Action, Adventure, Indie",76561199087242242,"Dead cells was my nickname in high school because i always had on crusty socks. this games okay though, i guess. or not idrk.",False,3,0,1762244005
Dead Cells,588650,24.99,0,solo,"Action, Adventure, Indie",76561198090217863,"Wanted to like this, it starts fun but devolves into tedious cell grind around bad progression system where you have to choose between cool unlocks and your characters getting stronger",False,4,0,1761591931
Dead Cells,588650,24.99,0,solo,"Action, Adventure, Indie",76561199278354979,"The most overrated roguelite of all time and it's not even close. I'm not sure what it is, I don't understand why, but I feel like this game gets tons of praise that I just don't get. I won't deny visually the game is definitely pretty to look at, but it doesn't really stand out much to me. Not much in this game stands out to me. Tons of cosmetics, tons of weapons, tons of utilities, tons of unlocks, tons of additional things you can get too like bombs or traps; it almost feels, dare I say, bloated. To me personally. But I wonder, why do I love having a ton of unlocks in games like Tboi or Ror2, but with this game I don't care for some reason? I think there may just be something in the core of this game that I don't like.

Some things I just straight up don't like: Level progression. This game's progression across levels feels so, so painfully muddled, and nonlinear. This could be something that very well might be fixed after playing the game for long enough, but dude, it's been 29, almost 30 hours of playtime as of right now. Why do I still not understand how I'm getting to like 70% of the levels I'm in. You start at level 1, then there's the two different level 2's, and then around each of those there's like 5 more levels that, I'm gonna be real, I can't even tell if they're actual main levels or just alternate areas. What the fuck is happening. I've probably been to like 10 different areas in the game so far. If you put a million dollars on the line, and put me in 7 of those areas and asked me ""Where are you in the game right now?"", I still could not give you a straight answer. It's just very needlessly over complicated.

I never cared too much for the combat either. I try to block enemies, but parry timing doesn't feel right that often. This could very well be a me thing but combat just feels very clunky, ESPECIALLY in the later levels when there's more enemies that have more complex and unpredictable attacks that are additionally sometimes stacked on top of each other. It's not the type of thing where enemies take turns either, shit will just attack you and that makes parrying so much harder. On top of this at the end of each level you have one mutation to pick, from a list of like 50+. It's just numbers. It's just a bunch of numbers, more damage when you do this, blocking does this, this ranged stuff is a little better, nothing stands out. It just all feels so lame and not unique or impactful enough at all. That's how a lot of stuff in this game feels for me, just a lot of Quantity > Quality, honestly.

If it sounds like I'm hating just to hate, I definitely get that don't get me wrong, but believe me, I'm not. I am STILL, from time and time again, coming back to this game and playing it for a bit, just to see if something sticks. As of right now though nothing has really grabbed my attention too much from this game. Nothing specific from it has made me truly yearn to come back to it, like a really cool weapon or gimmick or something. I'm just trying to find SOMETHING here, okay? I'm really trying, I promise. I see this game get a lot of positive reception, I want to understand it. This game's probably a better metroidvania than a roguelite honestly, and if that's your jam then that's awesome, dude. I may just not be that big of a fan of metroidvanias. As a big roguelite guy I wouldn't personally recommend it but that's just from my own personal taste.

This is stupid but I have to add this: Guys. This is the year 2025, and we STILL don't have options for adjusting the graphics in our game? Are we actually serious? This game just started running terribly for me as I've been trying to play it again now, with the same computer and everything, and I can't change fps or graphics or anything. I forgot but, I guess it is hard to advance past the prestigious, high-end computer technology of the late 90's. That is fucking INSANE, just ridiculous. Imagine not putting options for SOUNDS in your game, that's how dumb this is. It's just so stupid, I'm sorry.",False,2,2,1761460803
Dead Cells,588650,24.99,0,solo,"Action, Adventure, Indie",76561198016573659,"Massively overrated. WAY too grindy, subpar combat+movement, boring weapon/item system, terrible visual clarity in certain stages with certain enemies. There are far better roguelites on the market.",False,4,2,1761003059
Dead Cells,588650,24.99,0,solo,"Action, Adventure, Indie",76561198205440225,"Genuinely one of the games I hate the most. The only reason I have so many hours in it is: it started out seemingly fun and challenging - Sunken Cost Fallacy.
I could go on a rant but I won't, I'll just leave it at this...
This game is fucking ass.",False,0,3,1760483426
Dead Cells,588650,24.99,0,solo,"Action, Adventure, Indie",76561199570774028,emmmmmmmmmmm no,False,0,1,1759902761
Dead Cells,588650,24.99,0,solo,"Action, Adventure, Indie",76561198284311869,I'm not content,False,1,0,1759082835
Dead Cells,588650,24.99,0,solo,"Action, Adventure, Indie",76561198023518671,"Game is fun but small bugs and glitches ruin it.  

 - Ledge grabbing is hit or miss, creating annoying scenarios where you need to time movements or you will either repeatedly grab an ledge or keep missing

  

 - Drop down through floors needs changed to different buttons as the keys to drop (hold down + jump button) don't work well, together.  I will hold down and try to drop through the floor but instead I jump.  I try again and jump.  It takes a second to recognize the input but in a game where a split second can decide if you live or die should not rely on whether the game can read the input fast enough.  Not too mention levels with spikes just above your head and the game doesn't read you're holding down will make you jump into spikes.

- if too many enemy's are being hit by your attacks, a few may be ignored and freely attack you

- Weapon drop RNG needs refreshed as I'm getting drops for weapons I never use or don't work for upcoming levels.  Some effects rely on the environment but when only one level meets that criteria for the weapon, there's no point in using it.  Some are too slow to use and will never get any use.  Shields are completely useless and should be removed from the game.",False,5,2,1758936503
Dead Cells,588650,24.99,0,solo,"Action, Adventure, Indie",76561198101980421,"I’ll change my review to positive once Motion Twin adds a toggleable option to turn the Daily Challenge Ranking Window on or off. 
Of course, they probably won’t care about me anyway.",False,0,0,1758894365
Dead Cells,588650,24.99,0,solo,"Action, Adventure, Indie",76561198120018884,"Update: there is a nasty bug on steam deck: sometimes camera moves far far from the hero and I can't see a thing, only textures. It snaps back after a while, but you can easily die because you can't see anything for a 30 seconds or so.
I really REALLY wanted to love this game. I've read all stellar reviews and watched a bunch of videos. But when I actually started playing (and completed 0bc) it was totally souless experience. There is no heart, no characters. All there is - pure mechanical gameplay. And lots of randomness, everything is random! 
I can try to compare DC with Hades and there is nothing (!) in DC that can win me over. No story, too much randomness, no characters and mobs with annoying abilities. DC is totally overrated for what it is..",False,1,0,1758828252
Dead Cells,588650,24.99,0,solo,"Action, Adventure, Indie",76561198336306560,ok ive been playing this game on the xbox app it it was working perfecting on there so i got it on steam cuz it truned to be cheaper in here so i wonder what the bloody hell in dead cells doing for proforming problems it is lagging like crazy in only a few mintues that ive been playing it non stop lag in both button passes and creamer top it off its made me annoyed but my gf has gone and cry cuz of these issues so no i dont recommend it on stream xbox app runs so much better,False,0,0,1758538334
Dead Cells,588650,24.99,0,solo,"Action, Adventure, Indie",76561198005117051,"Game wasn´t catching me.
Maybe a bit overhyped. 
_________________

Main issue: 
even with lot of stuff to unlock the runs don´t feel like you are making progress at all or you make a real impact. 

You have like 3 classes which make different items /skills better - but there is less difference.
I mean c´mon, who cares if your turret shoots flames, canonballs or arrows. 
Same to e.g. swords, daggers - they just have like 3 attack patterns while hitting the smash button. 
You can hook, you can kick - that´s almost the highlights here. 

Don´t get me wrong: You CAN parry with a shield. There is variety (ice bow, explosions,...). But you carry (mostly) 2 weapons, 2 skills. And you will exchange them, due to ""level"" of items. Use & exchange w/ new one.
I´d have liked a ""upgrade your character"" thing, to really create a lasting build. 

You have 3 ""passive options"" to choose per run. To really make a difference this restriction is pain. 
Compare binding of isaac - you got tons of passive items, which also stack. Not here.
So don´t expect really awesome combos...

Bosses will get repetitive. Yes they get stronger and have different move sets while you make progress - they still feel the same. 
Maybe this is also because of the plain story... There is also no real benefit they provide for the run while defeating them. 

There is lot to like: in my case especially the art style, humor and references to other games.
But I was expecting something different.




",False,6,4,1758304885
Dead Cells,588650,24.99,0,solo,"Action, Adventure, Indie",76561199791869268,So you are going to put an ad for your new games on the title screen and refuse to fix the 'not so tough achievement' that keeps spamming in the middle of the screen when you play offline?,False,0,0,1758274630
Insurgency Sandstorm,412020,29.99,0,solo,Action,76561199697850125,Great game! I have beaten both metro 2033 redux games (the previous ones). I like metro exodus for it's graphics and great story. It does a really nice job to keep your interest in playing it but I got too scared of the mootants so I quit for two months and then continued. I don't recomend it to people that get scared easily.,True,0,0,1764182406
Insurgency Sandstorm,412020,29.99,0,solo,Action,76561198406290564,"For me, this game is ""A beautiful overrated and incredibly annoying test of patience"".

The intro were so effing long I had to go into the game folder and delete those darn three videos and you should do the same if you don't want to spent an hour long watching that shjt when you first start the game.

Slow pace, so much walking. There are literally 10 more badass soldier on the train and I have to do all the work for them, alone, make no sense. And my chick and her sugar daddy keep yelling at each other all the time.

NPCs talk a lot and continuously, and argue endlessly, one person hasn't finished speaking yet and the other has already jumped in and yelling. The English dub is really bad, cringe and tense with a weird accent, I had to switch to Russian dub to listen to it less annoying.

Annoying buzzing sound (on my watch I guess) really drive me crazy!! WTF what that? Idk if it is a bug/glitch or game's feature but I can not stand it any second. F that sheat!

One thing that seemed really cool at first but turned out to be really ridiculous was the sound effects, for example when an NPC was talking, I was standing right in front of them but when I turned the camera left/right/behind I couldn't hear them anymore, it was funny and ridiculous.

Well, based on the ""very positive"" reviews on steam, the game doesn't seem bad at all, maybe it just isn't for me, after 5 hours I'm lost it and I'm like ""fvck that shjt I'm out"".",True,0,0,1764171896
Insurgency Sandstorm,412020,29.99,0,solo,Action,76561199351536469,i waited so long and bought it but my grapic requirement didnt meet but now im on school laptop enoying it with most minimium requirement and boy im glad i waited,True,0,0,1764148567
Insurgency Sandstorm,412020,29.99,0,solo,Action,76561199104315163,Good game. What about Online Coop ?,True,0,0,1764136539
Insurgency Sandstorm,412020,29.99,0,solo,Action,76561198062715157,"There needs to be better controller view sensitivity options, but this is one of the best in the Metro series. Take your time in this game. Every action or inaction has consequences. Yeah you can kill the bridge guards, but then you will be branded a satanical heretic and the next area will have more guards ready.

Take your time and explore every building and nook and cranny and dear god put your mask on when it starts raining. 

When you get to the Urals, tell them Moscow is still alive.",True,0,0,1764128835
Insurgency Sandstorm,412020,29.99,0,solo,Action,76561199049415265,"Best story game i have played, underrated game.",True,0,0,1764109740
Insurgency Sandstorm,412020,29.99,0,solo,Action,76561199229914538,"One of the best games ive ever played
",True,0,0,1764094637
Insurgency Sandstorm,412020,29.99,0,solo,Action,76561198972760880,It is one of the best games.,True,0,0,1764065099
Insurgency Sandstorm,412020,29.99,0,solo,Action,76561198080557521,"This game is easily a 10/10 in my books the story is good the gameplay the literally everything
(ps if ur wondering the reason i have such low play time is because i played this game on another pc)",True,0,0,1764008272
Insurgency Sandstorm,412020,29.99,0,solo,Action,76561198357553503,Fucking garbage randomly crashes every 10 min,False,0,1,1764126822
Insurgency Sandstorm,412020,29.99,0,solo,Action,76561198422316631,"Crashes at startup. Seems to be a known issue dating back a number of years, and has not been fixed by the developers.",False,0,0,1763830921
Insurgency Sandstorm,412020,29.99,0,solo,Action,76561198971066170,"I HAVE LOST ALL MY 10 HOUR LONG PROGRESS BY NOTHING. WHAT THE HELL
",False,1,1,1763749960
Insurgency Sandstorm,412020,29.99,0,solo,Action,76561198116263088,"i can't remember why i used to be so obsess over this game back them, either it aged like milk or it always was boring asf",False,3,3,1763598699
Insurgency Sandstorm,412020,29.99,0,solo,Action,76561198351068000,"I would really like to have been able to enjoy this game, unfrotunately the game is unstable and prone to crashing. Which, if it happens, seems to have a VERY high likelyhood of just... Deleting/corrupting your save files. I've done the intro three times by now, it is getting really tiresome.",False,0,0,1763570362
Insurgency Sandstorm,412020,29.99,0,solo,Action,76561198021009279,"having to wait 5 minutes for the game to ""apply settings"" every time you change your graphics options is completely unacceptable.",False,3,1,1763253984
Insurgency Sandstorm,412020,29.99,0,solo,Action,76561197994134338,Crashes during the developer intros. Total garbage. Literally unplayable.,False,1,1,1762959817
Insurgency Sandstorm,412020,29.99,0,solo,Action,76561198008784242,It Crashes all the Time,False,0,0,1762877843
